[
  { "id": "voc.other_adverbs_responses.001", "en": "again", "zh": "再一次", "pos": "副詞", "topic": "other_adverbs_responses", "scope": "elementary_core", "difficulty_tier": 1, "ipa": null, "audio": null, "image": null, "sense_of": null, "related_forms": [], "example_sentence": { "en": "Can you say that again?", "zh": "你可以再說一次嗎？", "status": "draft" }, "source": "國小常用英語主題字彙 - Other Adverbs & Responses", "status": "published" },
  { "id": "voc.other_adverbs_responses.002", "en": "away", "zh": "離開、遠處", "pos": "副詞", "topic": "other_adverbs_responses", "scope": "elementary_core", "difficulty_tier": 1, "ipa": null, "audio": null, "image": null, "sense_of": null, "related_forms": [], "example_sentence": { "en": "The cat ran away quickly.", "zh": "貓咪很快跑走了。", "status": "draft" }, "source": "國小常用英語主題字彙 - Other Adverbs & Responses", "status": "published" },
  { "id": "voc.other_adverbs_responses.003", "en": "maybe", "zh": "也許", "pos": "副詞", "topic": "other_adverbs_responses", "scope": "elementary_core", "difficulty_tier": 1, "ipa": null, "audio": null, "image": null, "sense_of": null, "related_forms": [], "example_sentence": { "en": "Maybe we can go tomorrow.", "zh": "也許我們明天可以去。", "status": "draft" }, "source": "國小常用英語主題字彙 - Other Adverbs & Responses", "status": "published" },
  { "id": "voc.other_adverbs_responses.004", "en": "no", "zh": "不、不是", "pos": "副詞", "topic": "other_adverbs_responses", "scope": "elementary_core", "difficulty_tier": 1, "ipa": null, "audio": null, "image": null, "sense_of": null, "related_forms": [], "example_sentence": { "en": "No, thank you.", "zh": "不用了，謝謝。", "status": "draft" }, "source": "國小常用英語主題字彙 - Other Adverbs & Responses", "status": "published" },
  { "id": "voc.other_adverbs_responses.005", "en": "not", "zh": "不", "pos": "副詞", "topic": "other_adverbs_responses", "scope": "elementary_core", "difficulty_tier": 1, "ipa": null, "audio": null, "image": null, "sense_of": null, "related_forms": [], "example_sentence": { "en": "This is not my bag.", "zh": "這不是我的包包。", "status": "draft" }, "source": "國小常用英語主題字彙 - Other Adverbs & Responses", "status": "published" },
  { "id": "voc.other_adverbs_responses.006", "en": "officially", "zh": "正式地", "pos": "副詞", "topic": "other_adverbs_responses", "scope": "elementary_core", "difficulty_tier": 2, "ipa": null, "audio": null, "image": null, "sense_of": null, "related_forms": [], "example_sentence": { "en": "School officially starts in September.", "zh": "學校正式在九月開學。", "status": "draft" }, "source": "國小常用英語主題字彙 - Other Adverbs & Responses", "status": "published" },
  { "id": "voc.other_adverbs_responses.007", "en": "quickly", "zh": "快速地", "pos": "副詞", "topic": "other_adverbs_responses", "scope": "elementary_core", "difficulty_tier": 1, "ipa": null, "audio": null, "image": null, "sense_of": null, "related_forms": [], "example_sentence": { "en": "She finished her homework quickly.", "zh": "她很快就寫完功課了。", "status": "draft" }, "source": "國小常用英語主題字彙 - Other Adverbs & Responses", "status": "published" },
  { "id": "voc.other_adverbs_responses.008", "en": "really", "zh": "真的", "pos": "副詞", "topic": "other_adverbs_responses", "scope": "elementary_core", "difficulty_tier": 1, "ipa": null, "audio": null, "image": null, "sense_of": null, "related_forms": [], "example_sentence": { "en": "I am really excited about the trip.", "zh": "我對這趟旅行真的很期待。", "status": "draft" }, "source": "國小常用英語主題字彙 - Other Adverbs & Responses", "status": "published" },
  { "id": "voc.other_adverbs_responses.009", "en": "still", "zh": "仍然", "pos": "副詞", "topic": "other_adverbs_responses", "scope": "elementary_core", "difficulty_tier": 1, "ipa": null, "audio": null, "image": null, "sense_of": null, "related_forms": [], "example_sentence": { "en": "I am still hungry.", "zh": "我還是很餓。", "status": "draft" }, "source": "國小常用英語主題字彙 - Other Adverbs & Responses", "status": "published" },
  { "id": "voc.other_adverbs_responses.010", "en": "sure", "zh": "當然（回應用語）", "pos": "副詞", "topic": "other_adverbs_responses", "scope": "elementary_core", "difficulty_tier": 1, "ipa": null, "audio": null, "image": null, "sense_of": null, "related_forms": [], "example_sentence": { "en": "\"Can you help me?\" \"Sure!\"", "zh": "「你可以幫我嗎？」「當然！」", "status": "draft" }, "source": "國小常用英語主題字彙 - Other Adverbs & Responses", "status": "published" },
  { "id": "voc.other_adverbs_responses.011", "en": "then", "zh": "然後", "pos": "副詞", "topic": "other_adverbs_responses", "scope": "elementary_core", "difficulty_tier": 1, "ipa": null, "audio": null, "image": null, "sense_of": null, "related_forms": [], "example_sentence": { "en": "I ate lunch, then I did my homework.", "zh": "我吃了午餐，然後寫了功課。", "status": "draft" }, "source": "國小常用英語主題字彙 - Other Adverbs & Responses", "status": "published" },
  { "id": "voc.other_adverbs_responses.012", "en": "together", "zh": "一起", "pos": "副詞", "topic": "other_adverbs_responses", "scope": "elementary_core", "difficulty_tier": 1, "ipa": null, "audio": null, "image": null, "sense_of": null, "related_forms": [], "example_sentence": { "en": "We eat dinner together every night.", "zh": "我們每晚一起吃晚餐。", "status": "draft" }, "source": "國小常用英語主題字彙 - Other Adverbs & Responses", "status": "published" },
  { "id": "voc.other_adverbs_responses.013", "en": "too", "zh": "也、太", "pos": "副詞", "topic": "other_adverbs_responses", "scope": "elementary_core", "difficulty_tier": 1, "ipa": null, "audio": null, "image": null, "sense_of": null, "related_forms": [], "example_sentence": { "en": "I like ice cream too.", "zh": "我也喜歡冰淇淋。", "status": "draft" }, "source": "國小常用英語主題字彙 - Other Adverbs & Responses", "status": "published" },
  { "id": "voc.other_adverbs_responses.014", "en": "very", "zh": "非常", "pos": "副詞", "topic": "other_adverbs_responses", "scope": "elementary_core", "difficulty_tier": 1, "ipa": null, "audio": null, "image": null, "sense_of": null, "related_forms": [], "example_sentence": { "en": "This cake is very sweet.", "zh": "這個蛋糕非常甜。", "status": "draft" }, "source": "國小常用英語主題字彙 - Other Adverbs & Responses", "status": "published" },
  { "id": "voc.other_adverbs_responses.015", "en": "yes", "zh": "是的", "pos": "副詞", "topic": "other_adverbs_responses", "scope": "elementary_core", "difficulty_tier": 1, "ipa": null, "audio": null, "image": null, "sense_of": null, "related_forms": [], "example_sentence": { "en": "Yes, I would love to come.", "zh": "好啊，我很想來。", "status": "draft" }, "source": "國小常用英語主題字彙 - Other Adverbs & Responses", "status": "published" }
]
