[
  { "id": "voc.other_adjectives_2.001", "en": "poor", "zh": "貧窮的", "pos": "形容詞", "topic": "other_adjectives_2", "scope": "elementary_core", "difficulty_tier": 1, "ipa": null, "audio": null, "image": null, "sense_of": null, "related_forms": [], "example_sentence": { "en": "We help poor families in our town.", "zh": "我們幫助鎮上貧窮的家庭。", "status": "draft" }, "source": "國小常用英語主題字彙 - Other Adjectives II", "status": "published" },
  { "id": "voc.other_adjectives_2.002", "en": "rich", "zh": "富有的", "pos": "形容詞", "topic": "other_adjectives_2", "scope": "elementary_core", "difficulty_tier": 1, "ipa": null, "audio": null, "image": null, "sense_of": null, "related_forms": [], "example_sentence": { "en": "The rich man gave money to the school.", "zh": "那位富有的男士捐錢給學校。", "status": "draft" }, "source": "國小常用英語主題字彙 - Other Adjectives II", "status": "published" },
  { "id": "voc.other_adjectives_2.003", "en": "brave", "zh": "勇敢的", "pos": "形容詞", "topic": "other_adjectives_2", "scope": "elementary_core", "difficulty_tier": 1, "ipa": null, "audio": null, "image": null, "sense_of": null, "related_forms": [], "example_sentence": { "en": "The brave firefighter saved the cat.", "zh": "那位勇敢的消防員救了那隻貓。", "status": "draft" }, "source": "國小常用英語主題字彙 - Other Adjectives II", "status": "published" },
  { "id": "voc.other_adjectives_2.004", "en": "safe", "zh": "安全的", "pos": "形容詞", "topic": "other_adjectives_2", "scope": "elementary_core", "difficulty_tier": 1, "ipa": null, "audio": null, "image": null, "sense_of": null, "related_forms": [], "example_sentence": { "en": "Wear your helmet to stay safe.", "zh": "戴上安全帽保持安全。", "status": "draft" }, "source": "國小常用英語主題字彙 - Other Adjectives II", "status": "published" },
  { "id": "voc.other_adjectives_2.005", "en": "simple", "zh": "簡單的", "pos": "形容詞", "topic": "other_adjectives_2", "scope": "elementary_core", "difficulty_tier": 1, "ipa": null, "audio": null, "image": null, "sense_of": null, "related_forms": [], "example_sentence": { "en": "This recipe is simple to make.", "zh": "這道食譜很簡單。", "status": "draft" }, "source": "國小常用英語主題字彙 - Other Adjectives II", "status": "published" },
  { "id": "voc.other_adjectives_2.006", "en": "dim", "zh": "昏暗的", "pos": "形容詞", "topic": "other_adjectives_2", "scope": "elementary_core", "difficulty_tier": 2, "ipa": null, "audio": null, "image": null, "sense_of": null, "related_forms": [], "example_sentence": { "en": "The room was dim and quiet.", "zh": "房間昏暗又安靜。", "status": "draft" }, "source": "國小常用英語主題字彙 - Other Adjectives II", "status": "published" },
  { "id": "voc.other_adjectives_2.007", "en": "fit", "zh": "健康的、合身的", "pos": "形容詞", "topic": "other_adjectives_2", "scope": "elementary_core", "difficulty_tier": 2, "ipa": null, "audio": null, "image": null, "sense_of": null, "related_forms": [], "example_sentence": { "en": "Exercise keeps you fit.", "zh": "運動讓你保持健康。", "status": "draft" }, "source": "國小常用英語主題字彙 - Other Adjectives II", "status": "published" },
  { "id": "voc.other_adjectives_2.008", "en": "flat", "zh": "平坦的、扁的", "pos": "形容詞", "topic": "other_adjectives_2", "scope": "elementary_core", "difficulty_tier": 1, "ipa": null, "audio": null, "image": null, "sense_of": null, "related_forms": [], "example_sentence": { "en": "The road here is flat.", "zh": "這裡的路很平坦。", "status": "draft" }, "source": "國小常用英語主題字彙 - Other Adjectives II", "status": "published" },
  { "id": "voc.other_adjectives_2.009", "en": "glad", "zh": "高興的", "pos": "形容詞", "topic": "other_adjectives_2", "scope": "elementary_core", "difficulty_tier": 1, "ipa": null, "audio": null, "image": null, "sense_of": null, "related_forms": [], "example_sentence": { "en": "I am glad to see you.", "zh": "我很高興見到你。", "status": "draft" }, "source": "國小常用英語主題字彙 - Other Adjectives II", "status": "published" },
  { "id": "voc.other_adjectives_2.010", "en": "slim", "zh": "苗條的", "pos": "形容詞", "topic": "other_adjectives_2", "scope": "elementary_core", "difficulty_tier": 1, "ipa": null, "audio": null, "image": null, "sense_of": null, "related_forms": [], "example_sentence": { "en": "My aunt is tall and slim.", "zh": "我阿姨又高又苗條。", "status": "draft" }, "source": "國小常用英語主題字彙 - Other Adjectives II", "status": "published" },
  { "id": "voc.other_adjectives_2.011", "en": "funny", "zh": "有趣的、好笑的", "pos": "形容詞", "topic": "other_adjectives_2", "scope": "elementary_core", "difficulty_tier": 1, "ipa": null, "audio": null, "image": null, "sense_of": null, "related_forms": [], "example_sentence": { "en": "He told a very funny joke.", "zh": "他說了一個很好笑的笑話。", "status": "draft" }, "source": "國小常用英語主題字彙 - Other Adjectives II", "status": "published" },
  { "id": "voc.other_adjectives_2.012", "en": "lucky", "zh": "幸運的", "pos": "形容詞", "topic": "other_adjectives_2", "scope": "elementary_core", "difficulty_tier": 1, "ipa": null, "audio": null, "image": null, "sense_of": null, "related_forms": [], "example_sentence": { "en": "I feel lucky today.", "zh": "我今天覺得很幸運。", "status": "draft" }, "source": "國小常用英語主題字彙 - Other Adjectives II", "status": "published" },
  { "id": "voc.other_adjectives_2.013", "en": "noisy", "zh": "吵鬧的", "pos": "形容詞", "topic": "other_adjectives_2", "scope": "elementary_core", "difficulty_tier": 1, "ipa": null, "audio": null, "image": null, "sense_of": null, "related_forms": [], "example_sentence": { "en": "The playground is noisy at recess.", "zh": "下課時操場很吵鬧。", "status": "draft" }, "source": "國小常用英語主題字彙 - Other Adjectives II", "status": "published" },
  { "id": "voc.other_adjectives_2.014", "en": "silly", "zh": "傻氣的、滑稽的", "pos": "形容詞", "topic": "other_adjectives_2", "scope": "elementary_core", "difficulty_tier": 1, "ipa": null, "audio": null, "image": null, "sense_of": null, "related_forms": [], "example_sentence": { "en": "My dog does silly tricks.", "zh": "我的狗會做一些傻氣的把戲。", "status": "draft" }, "source": "國小常用英語主題字彙 - Other Adjectives II", "status": "published" },
  { "id": "voc.other_adjectives_2.015", "en": "tasty", "zh": "美味的", "pos": "形容詞", "topic": "other_adjectives_2", "scope": "elementary_core", "difficulty_tier": 1, "ipa": null, "audio": null, "image": null, "sense_of": null, "related_forms": [], "example_sentence": { "en": "This soup is very tasty.", "zh": "這道湯非常美味。", "status": "draft" }, "source": "國小常用英語主題字彙 - Other Adjectives II", "status": "published" },
  { "id": "voc.other_adjectives_2.016", "en": "awful", "zh": "很糟的、糟糕的", "pos": "形容詞", "topic": "other_adjectives_2", "scope": "elementary_core", "difficulty_tier": 1, "ipa": null, "audio": null, "image": null, "sense_of": null, "related_forms": [], "example_sentence": { "en": "The weather was awful yesterday.", "zh": "昨天的天氣很糟糕。", "status": "draft" }, "source": "國小常用英語主題字彙 - Other Adjectives II", "status": "published" },
  { "id": "voc.other_adjectives_2.017", "en": "careless", "zh": "粗心的", "pos": "形容詞", "topic": "other_adjectives_2", "scope": "elementary_core", "difficulty_tier": 2, "ipa": null, "audio": null, "image": null, "sense_of": null, "related_forms": [], "example_sentence": { "en": "Don't be careless with your homework.", "zh": "寫功課不要粗心。", "status": "draft" }, "source": "國小常用英語主題字彙 - Other Adjectives II", "status": "published" },
  { "id": "voc.other_adjectives_2.018", "en": "expensive", "zh": "昂貴的", "pos": "形容詞", "topic": "other_adjectives_2", "scope": "elementary_core", "difficulty_tier": 1, "ipa": null, "audio": null, "image": null, "sense_of": null, "related_forms": [], "example_sentence": { "en": "That toy is too expensive.", "zh": "那個玩具太貴了。", "status": "draft" }, "source": "國小常用英語主題字彙 - Other Adjectives II", "status": "published" },
  { "id": "voc.other_adjectives_2.019", "en": "tiring", "zh": "令人疲累的", "pos": "形容詞", "topic": "other_adjectives_2", "scope": "elementary_core", "difficulty_tier": 2, "ipa": null, "audio": null, "image": null, "sense_of": null, "related_forms": [], "example_sentence": { "en": "The long hike was tiring.", "zh": "那趟長途健行讓人很累。", "status": "draft" }, "source": "國小常用英語主題字彙 - Other Adjectives II", "status": "published" }
]
